{"sarif": {"version": "2.1.0", "$schema": "https://json.schemastore.org/sarif-2.1.0.json", "runs": [{"tool": {"driver": {"name": "code-review-aggregator", "rules": [], "supportedTaxonomies": []}}, "results": [{"fingerprints": {"matchBasedId/v1": "requires login"}, "locations": [{"physicalLocation": {"artifactLocation": {"uri": "/Users/jiri/Code/2026/agentic-skills/code-review/sdlc/docs/qa/analyzer-coverage/fixtures/python/sec_vuln.py", "uriBaseId": "%SRCROOT%"}, "region": {"endColumn": 44, "endLine": 8, "snippet": {"text": "    return subprocess.call(cmd, shell=True)  # bandit B602 / shell injection"}, "startColumn": 12, "startLine": 8}}}], "message": {"text": "subprocess invoked with shell=True (command injection risk)."}, "properties": {"sources": ["Semgrep OSS"], "sdlc_severity": "nit"}, "ruleId": "claude.skills.code-review.cache.semgrep.rules.qa-subprocess-shell-true", "taxa": []}, {"fingerprints": {"matchBasedId/v1": "requires login"}, "locations": [{"physicalLocation": {"artifactLocation": {"uri": "/Users/jiri/Code/2026/agentic-skills/code-review/sdlc/docs/qa/analyzer-coverage/fixtures/python/sec_vuln.py", "uriBaseId": "%SRCROOT%"}, "region": {"endColumn": 22, "endLine": 16, "snippet": {"text": "    return eval(expr)  # bandit B307 / dangerous eval"}, "startColumn": 12, "startLine": 16}}}], "message": {"text": "Use of eval() on potentially untrusted input."}, "properties": {"sources": ["Semgrep OSS"], "sdlc_severity": "nit"}, "ruleId": "claude.skills.code-review.cache.semgrep.rules.qa-dangerous-eval", "taxa": []}]}]}, "metrics": null, "ranked_hotspots": [], "analyzers": {"semgrep": {"sarif": {"version": "2.1.0", "runs": [{"invocations": [{"executionSuccessful": true, "toolExecutionNotifications": []}], "results": [{"fingerprints": {"matchBasedId/v1": "requires login"}, "locations": [{"physicalLocation": {"artifactLocation": {"uri": "/Users/jiri/Code/2026/agentic-skills/code-review/sdlc/docs/qa/analyzer-coverage/fixtures/python/sec_vuln.py", "uriBaseId": "%SRCROOT%"}, "region": {"endColumn": 44, "endLine": 8, "snippet": {"text": "    return subprocess.call(cmd, shell=True)  # bandit B602 / shell injection"}, "startColumn": 12, "startLine": 8}}}], "message": {"text": "subprocess invoked with shell=True (command injection risk)."}, "properties": {}, "ruleId": "claude.skills.code-review.cache.semgrep.rules.qa-subprocess-shell-true"}, {"fingerprints": {"matchBasedId/v1": "requires login"}, "locations": [{"physicalLocation": {"artifactLocation": {"uri": "/Users/jiri/Code/2026/agentic-skills/code-review/sdlc/docs/qa/analyzer-coverage/fixtures/python/sec_vuln.py", "uriBaseId": "%SRCROOT%"}, "region": {"endColumn": 22, "endLine": 16, "snippet": {"text": "    return eval(expr)  # bandit B307 / dangerous eval"}, "startColumn": 12, "startLine": 16}}}], "message": {"text": "Use of eval() on potentially untrusted input."}, "properties": {}, "ruleId": "claude.skills.code-review.cache.semgrep.rules.qa-dangerous-eval"}], "tool": {"driver": {"name": "Semgrep OSS", "rules": [{"defaultConfiguration": {"level": "error"}, "fullDescription": {"text": "Use of eval() on potentially untrusted input."}, "help": {"markdown": "Use of eval() on potentially untrusted input.", "text": "Use of eval() on potentially untrusted input."}, "id": "claude.skills.code-review.cache.semgrep.rules.qa-dangerous-eval", "name": "claude.skills.code-review.cache.semgrep.rules.qa-dangerous-eval", "properties": {"precision": "very-high", "tags": ["CWE-95", "security"]}, "shortDescription": {"text": "Semgrep Finding: claude.skills.code-review.cache.semgrep.rules.qa-dangerous-eval"}}, {"defaultConfiguration": {"level": "error"}, "fullDescription": {"text": "subprocess invoked with shell=True (command injection risk)."}, "help": {"markdown": "subprocess invoked with shell=True (command injection risk).", "text": "subprocess invoked with shell=True (command injection risk)."}, "id": "claude.skills.code-review.cache.semgrep.rules.qa-subprocess-shell-true", "name": "claude.skills.code-review.cache.semgrep.rules.qa-subprocess-shell-true", "properties": {"precision": "very-high", "tags": ["CWE-78", "security"]}, "shortDescription": {"text": "Semgrep Finding: claude.skills.code-review.cache.semgrep.rules.qa-subprocess-shell-true"}}], "semanticVersion": "1.161.0"}}}], "$schema": "https://docs.oasis-open.org/sarif/sarif/v2.1.0/os/schemas/sarif-schema-2.1.0.json"}, "metrics": null, "duration_s": 0.0, "status": "ok", "error": null}}}