{"sarif": {"version": "2.1.0", "$schema": "https://json.schemastore.org/sarif-2.1.0.json", "runs": [{"tool": {"driver": {"name": "code-review-aggregator", "rules": [], "supportedTaxonomies": []}}, "results": [{"level": "error", "message": {"text": "'unusedVar' is assigned a value but never used."}, "locations": [{"physicalLocation": {"artifactLocation": {"uri": "file:///Users/jiri/Code/2026/agentic-skills/code-review/sdlc/docs/qa/analyzer-coverage/fixtures/js/lint_me.js", "index": 2}, "region": {"startLine": 2, "startColumn": 7, "endLine": 2, "endColumn": 16}}}], "ruleId": "no-unused-vars", "ruleIndex": 0, "properties": {"sources": ["ESLint"], "sdlc_severity": "critical"}, "taxa": []}, {"level": "error", "message": {"text": "Unexpected 'debugger' statement."}, "locations": [{"physicalLocation": {"artifactLocation": {"uri": "file:///Users/jiri/Code/2026/agentic-skills/code-review/sdlc/docs/qa/analyzer-coverage/fixtures/js/lint_me.js", "index": 2}, "region": {"startLine": 5, "startColumn": 3, "endLine": 5, "endColumn": 12}}}], "ruleId": "no-debugger", "ruleIndex": 1, "properties": {"sources": ["ESLint"], "sdlc_severity": "critical"}, "taxa": []}]}]}, "metrics": null, "ranked_hotspots": [{"file": "file:///Users/jiri/Code/2026/agentic-skills/code-review/sdlc/docs/qa/analyzer-coverage/fixtures/js/lint_me.js", "composite_score": 8.0, "factors": {"severity_weighted_findings": 8.0, "cyclomatic_complexity": 0.0, "coupling": 0.0}}], "analyzers": {"eslint": {"sarif": {"version": "2.1.0", "$schema": "http://json.schemastore.org/sarif-2.1.0-rtm.5", "runs": [{"tool": {"driver": {"name": "ESLint", "informationUri": "https://eslint.org", "rules": [{"id": "no-unused-vars", "helpUri": "https://eslint.org/docs/latest/rules/no-unused-vars", "properties": {}, "shortDescription": {"text": "Disallow unused variables"}}, {"id": "no-debugger", "helpUri": "https://eslint.org/docs/latest/rules/no-debugger", "properties": {}, "shortDescription": {"text": "Disallow the use of `debugger`"}}], "version": "9.39.4"}}, "artifacts": [{"location": {"uri": "file:///Users/jiri/Code/2026/agentic-skills/code-review/sdlc/docs/qa/analyzer-coverage/fixtures/js/.dependency-cruiser.cjs"}}, {"location": {"uri": "file:///Users/jiri/Code/2026/agentic-skills/code-review/sdlc/docs/qa/analyzer-coverage/fixtures/js/eslint.config.js"}}, {"location": {"uri": "file:///Users/jiri/Code/2026/agentic-skills/code-review/sdlc/docs/qa/analyzer-coverage/fixtures/js/lint_me.js"}}], "results": [{"level": "error", "message": {"text": "'unusedVar' is assigned a value but never used."}, "locations": [{"physicalLocation": {"artifactLocation": {"uri": "file:///Users/jiri/Code/2026/agentic-skills/code-review/sdlc/docs/qa/analyzer-coverage/fixtures/js/lint_me.js", "index": 2}, "region": {"startLine": 2, "startColumn": 7, "endLine": 2, "endColumn": 16}}}], "ruleId": "no-unused-vars", "ruleIndex": 0}, {"level": "error", "message": {"text": "Unexpected 'debugger' statement."}, "locations": [{"physicalLocation": {"artifactLocation": {"uri": "file:///Users/jiri/Code/2026/agentic-skills/code-review/sdlc/docs/qa/analyzer-coverage/fixtures/js/lint_me.js", "index": 2}, "region": {"startLine": 5, "startColumn": 3, "endLine": 5, "endColumn": 12}}}], "ruleId": "no-debugger", "ruleIndex": 1}]}]}, "metrics": null, "duration_s": 0.0, "status": "ok", "error": null}}}