{"sarif": {"version": "2.1.0", "$schema": "https://json.schemastore.org/sarif-2.1.0.json", "runs": [{"tool": {"driver": {"name": "code-review-aggregator", "rules": [], "supportedTaxonomies": []}}, "results": [{"ruleId": "schemathesis.response_schema_violation", "level": "error", "message": {"text": "Response violates schema: 'user_name' is a required property\n\nSchema:\n\n    {\n        \"properties\": {\n            \"id\": {\n                \"type\": \"integer\",\n                \"title\": \"Id\"\n            },\n            \"user_name\": {\n                \"type\": \"string\",\n                \"title\": \"User Name\"\n            }\n        },\n        \"type\": \"object\",\n        \"required\": [\n            \"id\",\n            \"user_name\"\n        ],\n        \"title\": \"User\"\n    }\n\nValue:\n\n    {\n        \"id\": 0\n    }"}, "locations": [{"physicalLocation": {"artifactLocation": {"uri": "api"}, "region": {"startLine": 1}}}], "properties": {"endpoint": "GET /users/{user_id}", "sources": ["schemathesis"], "sdlc_severity": "critical"}, "taxa": []}]}]}, "metrics": null, "ranked_hotspots": [{"file": "api", "composite_score": 4.0, "factors": {"severity_weighted_findings": 4.0, "cyclomatic_complexity": 0.0, "coupling": 0.0}}], "analyzers": {"schemathesis": {"sarif": {"$schema": "https://docs.oasis-open.org/sarif/sarif/v2.1.0/errata01/os/schemas/sarif-schema-2.1.0.json", "version": "2.1.0", "runs": [{"tool": {"driver": {"name": "schemathesis", "version": "4.0.10", "rules": []}}, "results": [{"ruleId": "schemathesis.response_schema_violation", "level": "error", "message": {"text": "Response violates schema: 'user_name' is a required property\n\nSchema:\n\n    {\n        \"properties\": {\n            \"id\": {\n                \"type\": \"integer\",\n                \"title\": \"Id\"\n            },\n            \"user_name\": {\n                \"type\": \"string\",\n                \"title\": \"User Name\"\n            }\n        },\n        \"type\": \"object\",\n        \"required\": [\n            \"id\",\n            \"user_name\"\n        ],\n        \"title\": \"User\"\n    }\n\nValue:\n\n    {\n        \"id\": 0\n    }"}, "locations": [{"physicalLocation": {"artifactLocation": {"uri": "api"}, "region": {"startLine": 1}}}], "properties": {"endpoint": "GET /users/{user_id}"}}]}]}, "metrics": null, "duration_s": 0.0, "status": "ok", "error": null}}}