{"sarif": {"version": "2.1.0", "$schema": "https://json.schemastore.org/sarif-2.1.0.json", "runs": [{"tool": {"driver": {"name": "code-review-aggregator", "rules": [], "supportedTaxonomies": []}}, "results": [{"ruleId": "knip.unused-file", "message": {"text": "Unused file: src/clone_a.ts"}, "locations": [{"physicalLocation": {"artifactLocation": {"uri": "src/clone_a.ts"}, "region": {"startLine": 1}}}], "properties": {"sources": ["knip"], "sdlc_severity": "nit"}, "taxa": []}, {"ruleId": "knip.unused-file", "message": {"text": "Unused file: src/clone_b.ts"}, "locations": [{"physicalLocation": {"artifactLocation": {"uri": "src/clone_b.ts"}, "region": {"startLine": 1}}}], "properties": {"sources": ["knip"], "sdlc_severity": "nit"}, "taxa": []}, {"ruleId": "knip.unused-file", "message": {"text": "Unused file: src/cycle_a.ts"}, "locations": [{"physicalLocation": {"artifactLocation": {"uri": "src/cycle_a.ts"}, "region": {"startLine": 1}}}], "properties": {"sources": ["knip"], "sdlc_severity": "nit"}, "taxa": []}, {"ruleId": "knip.unused-file", "message": {"text": "Unused file: src/cycle_b.ts"}, "locations": [{"physicalLocation": {"artifactLocation": {"uri": "src/cycle_b.ts"}, "region": {"startLine": 1}}}], "properties": {"sources": ["knip"], "sdlc_severity": "nit"}, "taxa": []}]}]}, "metrics": null, "ranked_hotspots": [], "analyzers": {"knip": {"sarif": {"$schema": "https://docs.oasis-open.org/sarif/sarif/v2.1.0/errata01/os/schemas/sarif-schema-2.1.0.json", "version": "2.1.0", "runs": [{"tool": {"driver": {"name": "knip", "version": "5.0.0", "rules": []}}, "results": [{"ruleId": "knip.unused-file", "message": {"text": "Unused file: src/clone_a.ts"}, "locations": [{"physicalLocation": {"artifactLocation": {"uri": "src/clone_a.ts"}, "region": {"startLine": 1}}}]}, {"ruleId": "knip.unused-file", "message": {"text": "Unused file: src/clone_b.ts"}, "locations": [{"physicalLocation": {"artifactLocation": {"uri": "src/clone_b.ts"}, "region": {"startLine": 1}}}]}, {"ruleId": "knip.unused-file", "message": {"text": "Unused file: src/cycle_a.ts"}, "locations": [{"physicalLocation": {"artifactLocation": {"uri": "src/cycle_a.ts"}, "region": {"startLine": 1}}}]}, {"ruleId": "knip.unused-file", "message": {"text": "Unused file: src/cycle_b.ts"}, "locations": [{"physicalLocation": {"artifactLocation": {"uri": "src/cycle_b.ts"}, "region": {"startLine": 1}}}]}]}]}, "metrics": null, "duration_s": 0.0, "status": "ok", "error": null}}}