{"sarif": {"version": "2.1.0", "$schema": "https://json.schemastore.org/sarif-2.1.0.json", "runs": [{"tool": {"driver": {"name": "code-review-aggregator", "rules": [], "supportedTaxonomies": []}}, "results": []}], "properties": {"analyzer_errors": [{"error": "depcruise exited 1: file:///Users/jiri/Code/2026/agentic-skills/code-review/.claude/skills/code-review/node_modules/dependency-cruiser/src/cli/utl/assert-file-existence.mjs:1\nimport { accessSync, R_OK } from \"node:fs\";\n                     ^^^^\nSyntaxError: The requested module 'node:fs' does not provide an export named 'R_OK'\n    at #asyncInstantiate (node:internal/modules/esm/module_job:319:21)\n    at process.processTicksAndRejections (node:internal/process/task_queues:104:5)\n    at async ModuleJob.run (node:internal/modules/esm/module_job:422:5)\n    at async onImport.tracePromise.__proto__ (node:internal/modules/esm/loader:661:26)\n    at async asyncRunEntryPointWithESMLoader (node:internal/modules/run_main:101:5)\n\nNode.js v24.14.1\n", "status": "error"}]}}, "metrics": null, "ranked_hotspots": [], "analyzers": {"depcruiser": {"sarif": {}, "metrics": null, "duration_s": 0.0, "status": "error", "error": "depcruise exited 1: file:///Users/jiri/Code/2026/agentic-skills/code-review/.claude/skills/code-review/node_modules/dependency-cruiser/src/cli/utl/assert-file-existence.mjs:1\nimport { accessSync, R_OK } from \"node:fs\";\n                     ^^^^\nSyntaxError: The requested module 'node:fs' does not provide an export named 'R_OK'\n    at #asyncInstantiate (node:internal/modules/esm/module_job:319:21)\n    at process.processTicksAndRejections (node:internal/process/task_queues:104:5)\n    at async ModuleJob.run (node:internal/modules/esm/module_job:422:5)\n    at async onImport.tracePromise.__proto__ (node:internal/modules/esm/loader:661:26)\n    at async asyncRunEntryPointWithESMLoader (node:internal/modules/run_main:101:5)\n\nNode.js v24.14.1\n"}}}