{"sarif": {"version": "2.1.0", "$schema": "https://json.schemastore.org/sarif-2.1.0.json", "runs": [{"tool": {"driver": {"name": "code-review-aggregator", "rules": [], "supportedTaxonomies": []}}, "results": []}]}, "metrics": {"per_file": {"/Users/jiri/Code/2026/agentic-skills/code-review/sdlc/docs/qa/analyzer-coverage/fixtures/python/dead_code.py": {"functions": [{"name": "used_function", "cc": 1, "lineno": 7, "rank": "F"}, {"name": "_unused_function", "cc": 1, "lineno": 11, "rank": "F"}, {"name": "UnusedClass", "cc": 1, "lineno": 16, "rank": "C"}], "max_cc": 1, "average_cc": 1.0}, "/Users/jiri/Code/2026/agentic-skills/code-review/sdlc/docs/qa/analyzer-coverage/fixtures/python/complex_fn.py": {"functions": [{"name": "tangled", "cc": 13, "lineno": 4, "rank": "F"}], "max_cc": 13, "average_cc": 13.0}, "/Users/jiri/Code/2026/agentic-skills/code-review/sdlc/docs/qa/analyzer-coverage/fixtures/python/low_cohesion.py": {"functions": [{"name": "GrabBag", "cc": 2, "lineno": 4, "rank": "C"}, {"name": "__init__", "cc": 1, "lineno": 5, "rank": "M"}, {"name": "only_alpha", "cc": 1, "lineno": 11, "rank": "M"}, {"name": "only_beta", "cc": 1, "lineno": 14, "rank": "M"}, {"name": "unrelated", "cc": 1, "lineno": 17, "rank": "M"}, {"name": "also_unrelated", "cc": 1, "lineno": 20, "rank": "M"}], "max_cc": 2, "average_cc": 1.1666666666666667}, "/Users/jiri/Code/2026/agentic-skills/code-review/sdlc/docs/qa/analyzer-coverage/fixtures/python/sec_vuln.py": {"functions": [{"name": "run_shell", "cc": 1, "lineno": 7, "rank": "F"}, {"name": "weak_hash", "cc": 1, "lineno": 11, "rank": "F"}, {"name": "run_eval", "cc": 1, "lineno": 15, "rank": "F"}, {"name": "load_untrusted", "cc": 1, "lineno": 19, "rank": "F"}], "max_cc": 1, "average_cc": 1.0}}, "per_class": {}, "coupling": {}}, "ranked_hotspots": [], "analyzers": {"radon": {"sarif": {"$schema": "https://docs.oasis-open.org/sarif/sarif/v2.1.0/errata01/os/schemas/sarif-schema-2.1.0.json", "version": "2.1.0", "runs": [{"tool": {"driver": {"name": "radon", "version": "6.0.1", "rules": []}}, "results": []}]}, "metrics": {"per_file": {"/Users/jiri/Code/2026/agentic-skills/code-review/sdlc/docs/qa/analyzer-coverage/fixtures/python/dead_code.py": {"functions": [{"name": "used_function", "cc": 1, "lineno": 7, "rank": "F"}, {"name": "_unused_function", "cc": 1, "lineno": 11, "rank": "F"}, {"name": "UnusedClass", "cc": 1, "lineno": 16, "rank": "C"}], "max_cc": 1, "average_cc": 1.0}, "/Users/jiri/Code/2026/agentic-skills/code-review/sdlc/docs/qa/analyzer-coverage/fixtures/python/complex_fn.py": {"functions": [{"name": "tangled", "cc": 13, "lineno": 4, "rank": "F"}], "max_cc": 13, "average_cc": 13.0}, "/Users/jiri/Code/2026/agentic-skills/code-review/sdlc/docs/qa/analyzer-coverage/fixtures/python/low_cohesion.py": {"functions": [{"name": "GrabBag", "cc": 2, "lineno": 4, "rank": "C"}, {"name": "__init__", "cc": 1, "lineno": 5, "rank": "M"}, {"name": "only_alpha", "cc": 1, "lineno": 11, "rank": "M"}, {"name": "only_beta", "cc": 1, "lineno": 14, "rank": "M"}, {"name": "unrelated", "cc": 1, "lineno": 17, "rank": "M"}, {"name": "also_unrelated", "cc": 1, "lineno": 20, "rank": "M"}], "max_cc": 2, "average_cc": 1.1666666666666667}, "/Users/jiri/Code/2026/agentic-skills/code-review/sdlc/docs/qa/analyzer-coverage/fixtures/python/sec_vuln.py": {"functions": [{"name": "run_shell", "cc": 1, "lineno": 7, "rank": "F"}, {"name": "weak_hash", "cc": 1, "lineno": 11, "rank": "F"}, {"name": "run_eval", "cc": 1, "lineno": 15, "rank": "F"}, {"name": "load_untrusted", "cc": 1, "lineno": 19, "rank": "F"}], "max_cc": 1, "average_cc": 1.0}}, "per_class": {}, "coupling": {}}, "duration_s": 0.0, "status": "ok", "error": null}}}